{
  "schemaVersion": 1,
  "id": "aerok-dark",
  "name": "Aerok Dark",
  "description": "Aerok 深色控制台主题，使用品牌蓝色操作信号与层次化深蓝表面。",
  "mode": "dark",
  "token": {
    "colorPrimary": "#3258D0",
    "colorSuccess": "#73D13D",
    "colorWarning": "#D89614",
    "colorError": "#DC4446",
    "colorInfo": "#2F83DC",
    "colorTextBase": "#E7EAF2",
    "colorBgBase": "#090D16",
    "colorText": "#E7EAF2",
    "colorTextSecondary": "#B0B6C5",
    "colorTextTertiary": "#8B94A7",
    "colorTextQuaternary": "#808AA0",
    "colorTextDisabled": "#808AA0",
    "colorBgContainer": "#121722",
    "colorBgElevated": "#1B2230",
    "colorBgLayout": "#090D16",
    "colorBgSpotlight": "#273142",
    "colorBorder": "rgba(95, 112, 156, 0.32)",
    "colorBorderSecondary": "rgba(95, 112, 156, 0.18)",
    "colorFillAlter": "rgba(105, 121, 158, 0.08)",
    "colorFillContent": "rgba(105, 121, 158, 0.13)",
    "colorFillContentHover": "rgba(105, 121, 158, 0.18)",
    "colorLink": "#7796F5",
    "colorLinkHover": "#9AAFFC",
    "colorLinkActive": "#5879E3",
    "colorPrimaryHover": "#6686EA",
    "colorPrimaryActive": "#2847AD",
    "colorPrimaryBg": "#17203A",
    "controlOutline": "rgba(70, 105, 222, 0.28)"
  }
}
