{
  "schemaVersion": 1,
  "id": "gateway-dark",
  "name": "Gateway Dark",
  "description": "Artifact Gateway 默认深色主题（设计语言 v2）：中性分层表面、前景色主操作，青色只用于链接、焦点与当前位置。",
  "mode": "dark",
  "token": {
    "colorPrimary": "#06B6D4",
    "colorSuccess": "#4ADE80",
    "colorWarning": "#FBBF24",
    "colorError": "#F87171",
    "colorInfo": "#22D3EE",
    "colorTextBase": "#EDEDEF",
    "colorBgBase": "#09090B",
    "colorText": "#EDEDEF",
    "colorTextSecondary": "#A1A1AA",
    "colorTextTertiary": "#8B8B94",
    "colorTextQuaternary": "#85858F",
    "colorTextDisabled": "#52525B",
    "colorBgContainer": "#111114",
    "colorBgElevated": "#18181C",
    "colorBgLayout": "#09090B",
    "colorBgSpotlight": "#27272A",
    "colorBorder": "rgba(255, 255, 255, 0.10)",
    "colorBorderSecondary": "rgba(255, 255, 255, 0.07)",
    "colorFillAlter": "rgba(255, 255, 255, 0.03)",
    "colorFillContent": "rgba(255, 255, 255, 0.06)",
    "colorFillContentHover": "rgba(255, 255, 255, 0.09)",
    "colorLink": "#22D3EE",
    "colorLinkHover": "#67E8F9",
    "colorLinkActive": "#0891B2",
    "colorPrimaryHover": "#22D3EE",
    "colorPrimaryActive": "#0891B2",
    "controlOutline": "rgba(34, 211, 238, 0.40)"
  }
}
