{
  "schemaVersion": 1,
  "id": "gateway-light",
  "name": "Gateway Light",
  "description": "Artifact Gateway 默认浅色主题（设计语言 v2）：与深色主题层级一致，前景色主操作，青蓝色只用于链接、焦点与当前位置。",
  "mode": "light",
  "token": {
    "colorPrimary": "#0891B2",
    "colorSuccess": "#147A3B",
    "colorWarning": "#A94E09",
    "colorError": "#B91C1C",
    "colorInfo": "#0E7490",
    "colorTextBase": "#18181B",
    "colorBgBase": "#F7F7F8",
    "colorText": "#18181B",
    "colorTextSecondary": "#52525B",
    "colorTextTertiary": "#63636C",
    "colorTextQuaternary": "#6B6B74",
    "colorTextDisabled": "#71717A",
    "colorBgContainer": "#FFFFFF",
    "colorBgElevated": "#FFFFFF",
    "colorBgLayout": "#F7F7F8",
    "colorBgSpotlight": "#27272A",
    "colorBorder": "#E4E4E7",
    "colorBorderSecondary": "#ECECEF",
    "colorFillAlter": "#F7F7F8",
    "colorFillContent": "#F0F0F2",
    "colorFillContentHover": "#E9E9EC",
    "colorLink": "#0E7490",
    "colorLinkHover": "#164E63",
    "colorLinkActive": "#155E75",
    "colorPrimaryHover": "#0E7490",
    "colorPrimaryActive": "#155E75",
    "controlOutline": "rgba(14, 116, 144, 0.35)"
  }
}
